Timestamp,Action,Category,Details,Files Affected,Status
2026-05-26 10:00:00,Clone repository,Setup,"Cloned https://github.com/Abady001/Meter-.git into D:\meter\Meter-",None,Completed
2026-05-26 10:05:00,Update AGENTS.md,Documentation,"Created comprehensive AGENTS.md with stack info, commands, constraints, rules",AGENTS.md,Completed
2026-05-26 10:15:00,Read all spec files,Analysis,"Read spec.md, plan.md, research.md, data-model.md, tasks.md (85 tasks), contracts",Multiple spec files,Completed
2026-05-26 10:20:00,Verify git remote,Verification,"Confirmed remote = https://github.com/Abady001/Meter-.git, branch main, up to date",None,Completed
2026-05-26 10:30:00,Install Bun,Environment,"Installed Bun v1.3.14 via npm install -g bun",None,Completed
2026-05-26 10:32:00,Install NestJS CLI,Environment,"Installed @nestjs/cli v11.0.21 globally",None,Completed
2026-05-26 10:35:00,Install frontend deps,Environment,"Installed 847 npm packages for Frontend/",Frontend/node_modules,Completed
2026-05-26 10:40:00,Install Playwright browser,Environment,"Downloaded Chromium for smoke tests",None,Completed
2026-05-26 10:45:00,Create required-apps.txt,Documentation,"Created file listing all applications used in project",required-apps.txt,Completed
2026-05-26 10:50:00,Verify frontend health,Verification,"ESLint passed, Next.js build compiled successfully, smoke test browser ready",None,Completed
2026-05-26 11:00:00,Create docker-compose.yml,Infrastructure,"Created backend/docker-compose.yml for PostgreSQL 16 container",backend/docker-compose.yml,Completed
2026-05-26 11:05:00,Start PostgreSQL,Infrastructure,"Started meter-pulse-db container (postgres:16-alpine), port 5432",None,Completed
2026-05-26 11:15:00,Install Python 3.12,Environment,"Installed Python 3.12.13 via uv python install 3.12",None,Completed
2026-05-26 11:18:00,Install Speckit CLI,Environment,"Installed specify-cli v0.8.13 from github/spec-kit via uv tool install",None,Completed
2026-05-26 11:22:00,Install Graphify,Environment,"Installed graphifyy v0.8.18 via uv tool install, configured for OpenCode platform",None,Completed
2026-05-26 11:30:00,Fetch remote branches,Git,"Discovered remote branches: origin/001-metering-billing-platform, origin/feature/t003-backend-tooling",None,Completed
2026-05-26 11:35:00,Merge remote work,Git,"Merged origin/feature/t003-backend-tooling into main (27 files, T001+T002+T003 completed)",Multiple backend files,Completed
2026-05-26 11:40:00,Install backend deps,Environment,"Installed backend npm packages (NestJS, pg, ts-node, etc.)",backend/node_modules,Completed
2026-05-26 11:42:00,Verify backend build,Verification,"TypeScript compilation passed, ESLint passed",None,Completed
2026-05-26 11:50:00,Create github-packages-needed.md,Documentation,"Created markdown file listing 30+ GitHub tools with versions, purposes, links",documentation/github-packages-needed.md,Completed
2026-05-26 11:52:00,Create github-packages-needed.txt,Documentation,"Created plain-text version of GitHub tools documentation",documentation/github-packages-needed.txt,Completed
2026-05-26 11:55:00,Move required-apps.txt,Documentation,"Moved to documentation/ folder",documentation/required-apps.txt,Completed
2026-05-26 12:00:00,Final verification,Verification,"Frontend lint+build OK, Backend build+lint OK, Docker healthy, Speckit OK, Graphify OK",None,Completed
2026-05-26 12:10:00,Create conversation-log.md,Documentation,"Full session prompt/reply history with timestamps and decisions",documentation/01-conversation-log.md,Completed
2026-05-26 12:15:00,Create memory-files.md,Documentation,"Documented all agent memory, skill files, config files",documentation/02-memory-files.md,Completed
2026-05-26 12:20:00,Create database-schema-overview.md,Documentation,"Full entity relationship model with 20 tables, state transitions, business rules",documentation/03-database-schema-overview.md,Completed
2026-05-26 12:25:00,Create audit-log.csv,Documentation,"Complete action log with timestamps for this session",documentation/04-audit-log.csv,Completed
2026-05-26 12:30:00,Create programming-languages.md,Documentation,"Languages used and planned across full project",documentation/05-programming-languages.md,Completed
2026-05-26 12:35:00,Create documentation-index.md,Documentation,"Index of all documentation files with descriptions and functions",documentation/00-index.md,Completed
2026-05-26 12:40:00,Restructure documentation folder,Reorganization,"Created subfolders: markdown/, sql/, text/, excel/, pdf/",documentation/,Completed
2026-05-26 12:41:00,Move files to subfolders,Reorganization,"Moved .md → markdown/, .txt → text/, .csv → excel/",Multiple,Completed
2026-05-26 12:42:00,Generate SQL DDL,Generation,"Created full PostgreSQL DDL with 20 tables, enums, indexes, views, triggers",documentation/sql/03-database-schema.sql,Completed
2026-05-26 12:45:00,Generate text versions,Generation,"Created plain-text versions of all markdown documentation",documentation/text/,Completed
2026-05-26 12:46:00,Generate CSV data,Generation,"Created structured CSV: tables, state transitions, business rules, languages, packages",documentation/excel/,Completed
2026-05-26 12:48:00,Generate PDF versions,Generation,"Created PDF versions of all documentation files using Node.js",documentation/pdf/,Completed
2026-05-26 12:50:00,Update index for new structure,Documentation,"Updated 00-index.md with subfolder listing, file inventory table, and how-to-use guide",documentation/markdown/00-index.md,Completed
2026-05-26 12:55:00,Configure git user,Git,"Set user.name=Kirllos Hany, user.email=kirllos.hany@epower.com.eg",None,Completed
2026-05-26 12:56:00,Store GitHub token,Git,"Stored PAT credential for pushing to Abady001/Meter-",None,Completed
2026-05-26 12:58:00,Create commit log files,Documentation,"Created 09-git-commit-log.md, .txt, .csv, .pdf with baseline commits",documentation/,Completed
2026-05-26 13:00:00,Update AGENTS.md with discipline rules,Git,"Added commit/push discipline, git check on each message, token rules",AGENTS.md,Completed
2026-05-26 13:05:00,Create daily email report log,Documentation,"Created 11-email-report-log.md, .txt, .csv, .pdf — daily email tracking spreadsheet",documentation/,Completed
2026-05-26 13:06:00,Create progress health report,Documentation,"Created 10-progress-health-report.md, .txt, .pdf — full system health + 3.3% progress",documentation/,Completed
2026-05-26 13:20:00,Fix backend port to 3001,Backend,"Changed main.ts default port from 3000 to 3001 (avoid frontend conflict)",backend/src/main.ts,Completed
2026-05-26 13:21:00,Create .env file,Backend,"Created backend/.env with Docker PostgreSQL credentials",backend/.env,Completed
2026-05-26 13:22:00,Create sim_system schema,Database,"Created sim_system schema in Docker PostgreSQL",None,Completed
2026-05-26 13:23:00,Full T001+T002+T003 verification,Testing,"Build PASS, Lint PASS, Prettier PASS, Jest PASS, Health {"status":"ok"} PASS",backend/,Completed
2026-05-26 13:24:00,Fix Prettier formatting,Backend,"Ran prettier --write on 6 files",backend/src/,Completed
2026-05-26 13:25:00,Update .env.example,Backend,"Synced .env.example with actual Docker credentials (port 3001, meter_pulse user)",backend/.env.example,Completed
2026-05-26 13:40:00,Implement T004 - Prisma ORM,T004,"Installed prisma v6.19.3, created schema.prisma (generator+datasource), PrismaService, updated DatabaseModule, added DATABASE_URL",backend/,Completed
2026-05-26 13:42:00,T004 verification,T004,"prisma validate PASS, prisma generate PASS, tsc PASS, server boot with Prisma connected PASS",backend/,Completed
